{
  "schemaVersion": "2.0", "problemType": "NESTING_2D", "clientRequestId": "MCP-example",
  "allowFallback": false, "requireComplete": true,
  "problem": {
    "schemaVersion": "1", "unit": "mm",
    "material": { "id": "external-material", "shape": { "type": "RECTANGLE", "width": 2000, "height": 3000, "vertices": [] }, "exclusions": [], "continuesAfterRegion": false },
    "parts": [{ "id": 1, "name": "example-part", "shape": { "type": "RECTANGLE", "width": 2000, "height": 1000, "vertices": [] }, "quantity": 3, "allowRotation": false }],
    "process": { "mode": "CROSSCUT", "feedMode": "SHEET", "startCorner": "left-top", "firstStageOrientation": "horizontal", "trimStart": 0, "minReusableWidth": 200, "minReusableHeight": 300, "kerf": 0, "objective": "INPUT_ORDER", "pieceGap": 0 },
    "engine": "auto", "timeLimitSeconds": 3
  }
}
